Sheet: Sheet1
B2: START TIME | C2: BEGIN TIME | D2: FINISH TIME | F2: CYCLE TIME | G2: LEAD TIME
A3: HOUR 1 | B3: 2017-10-13T14:12:00.000 | C3: 2017-10-17T18:47:59.999997000 | D3: 2017-10-17T23:39:00.000003000 | F3: of:= ([.D3] - [.C3]) * 24 -> 4.85000000009313 | G3: of:= ([.D3] - [.B3]) * 24 -> 105.450000000768
A4: HOUR 2 | B4: 2017-10-13T14:12:00.000 | C4: 2017-10-17T18:48:00.000 | D4: 2017-10-19T22:50:00.000 | F4: of:= ([.D4] - [.C4]) * 24 -> 52.0333333333838 | G4: of:= ([.D4] - [.B4]) * 24 -> 152.63333333336
A5: HOUR 3 | B5: 2017-10-13T14:12:00.000 | C5: 2017-10-19T22:50:00.000 | D5: 2017-10-21T04:46:00.000 | F5: of:= ([.D5] - [.C5]) * 24 -> 29.9333333332906 | G5: of:= ([.D5] - [.B5]) * 24 -> 182.566666666651
A6: HOUR 4 | B6: 2017-10-13T14:12:00.000 | C6: 2017-10-21T04:49:00.000 | D6: 2017-10-21T14:13:00.000 | F6: of:= ([.D6] - [.C6]) * 24 -> 9.40000000008149 | G6: of:= ([.D6] - [.B6]) * 24 -> 192.016666666721
A7: HOUR 5 | B7: 2017-10-13T14:12:00.000 | C7: 2017-10-17T18:48:00.000 | D7: 2017-10-19T21:18:00.000 | F7: of:= ([.D7] - [.C7]) * 24 -> 50.4999999999418 | G7: of:= ([.D7] - [.B7]) * 24 -> 151.099999999919
A8: HOUR 8 | B8: 2017-10-13T14:14:00.000 | C8: 2017-10-19T22:50:00.000 | D8: 2017-10-22T14:26:00.000 | F8: of:= ([.D8] - [.C8]) * 24 -> 63.6000000000349 | G8: of:= ([.D8] - [.B8]) * 24 -> 216.200000000128
A9: HOUR 14 | B9: 2017-10-13T14:16:00.000 | C9: 2017-10-19T18:48:00.000 | D9: 2017-10-22T14:22:00.000 | F9: of:= ([.D9] - [.C9]) * 24 -> 67.5666666667094 | G9: of:= ([.D9] - [.B9]) * 24 -> 216.099999999977
A10: HOUR 15 | B10: 2017-10-13T14:16:00.000 | C10: 2017-10-19T18:48:00.000 | D10: 2017-10-22T15:49:00.000 | F10: of:= ([.D10] - [.C10]) * 24 -> 69.016666666721 | G10: of:= ([.D10] - [.B10]) * 24 -> 217.549999999988
A11: HOUR 16 | B11: 2017-10-13T14:16:00.000 | C11: 2017-10-17T18:52:00.000 | D11: 2017-10-22T15:49:00.000 | F11: of:= ([.D11] - [.C11]) * 24 -> 116.950000000012 | G11: of:= ([.D11] - [.B11]) * 24 -> 217.549999999988
A12: HOUR 17 | B12: 2017-10-13T14:18:00.000 | C12: N/A | D12: N/A | F12: of:= 0 -> 0 | G12: of:=0 -> 0
A13: HOUR 18 | B13: 2017-10-13T14:18:00.000 | C13: 2017-10-17T18:52:00.000 | D13: 2017-10-22T15:49:00.000 | F13: of:= ([.D13] - [.C13]) * 24 -> 116.950000000012 | G13: of:= ([.D13] - [.B13]) * 24 -> 217.516666666721
A14: HOUR 23 | B14: 2017-10-13T14:19:00.000 | C14: 2017-10-21T04:47:00.000 | D14: 2017-10-21T14:58:00.000 | F14: of:= ([.D14] - [.C14]) * 24 -> 10.1833333333489 | G14: of:= ([.D14] - [.B14]) * 24 -> 192.650000000023
A15: HOUR 27 | B15: 2017-10-15T21:44:00.000 | C15: N/A | D15: N/A | F15: of:=0 -> 0 | G15: of:= 0 -> 0
A16: HOUR 20 | B16: 2017-10-13T14:18:00.000 | C16: 2017-10-19T14:11:00.000 | D16: N/A | F16: of:=0 -> 0 | G16: of:= 0 -> 0
A17: HOUR 21 | B17: 2017-10-13T14:19:00.000 | C17: 2017-10-22T18:20:00.000 | D17: N/A | F17: of:= 0 -> 0 | G17: of:=0 -> 0
F19: AVERAGE CYCLE TIME | G19: AVERAGE LEAD TIME
F20: of:=AVERAGE([.F3:.F17]) -> 39.3988888889085 | G20: of:=AVERAGE([.G3:.G17]) -> 137.422222222283